{
  "$schema": "https://json-schema.org/draft/2020-12/schema",
  "$id": "medioevo.agent_state.v0.1",
  "title": "AgentState",
  "type": "object",
  "required": ["schema_version", "agent_id", "body", "needs", "traits", "lineage", "sensory_profile", "bias_profile", "memory", "beliefs", "goals", "relationships", "role", "skills", "emotional_state", "cognitive_load", "R_i", "Phi_eff_i", "boundary"],
  "properties": {
    "schema_version": { "const": "medioevo.agent_state.v0.1" },
    "agent_id": { "type": "string" },
    "body": { "type": "object" },
    "needs": { "type": "object" },
    "traits": { "type": "array" },
    "lineage": { "type": "object" },
    "sensory_profile": { "type": "object" },
    "bias_profile": { "type": "object" },
    "memory": { "type": "array" },
    "beliefs": { "type": "array" },
    "goals": { "type": "array" },
    "relationships": { "type": "object" },
    "role": { "type": "string" },
    "skills": { "type": "array" },
    "emotional_state": { "type": "object" },
    "cognitive_load": { "type": "number" },
    "R_i": { "type": "number" },
    "Phi_eff_i": { "type": "number" },
    "boundary": { "type": "object" }
  },
  "additionalProperties": false
}

