{
  "schema_version": "medioevo.agent_state.v0.1",
  "agent_id": "agent-003",
  "body": { "pose": { "x": 4, "y": 2, "z": 0 }, "health": 0.95 },
  "needs": { "energy": 0.75, "hunger": 0.68, "social": 0.8, "purpose": 0.66 },
  "traits": ["mediator", "curious"],
  "lineage": { "lineage_id": "lineage-agent-003", "inherited_traits": ["social"] },
  "sensory_profile": { "visual": 0.7, "audio": 0.75, "text": 0.8 },
  "bias_profile": { "profile_id": "bias-agent-003", "role_bias": { "social": 0.5 } },
  "memory": ["mediated_market_demo"],
  "beliefs": ["contradictions_need_resolution"],
  "goals": ["stabilize_shared_reality"],
  "relationships": { "agent-001": 0.2, "agent-002": 0.15 },
  "role": "Mediator",
  "skills": ["dialogue", "triage"],
  "emotional_state": { "valence": 0.3, "arousal": 0.35 },
  "cognitive_load": 0.28,
  "R_i": 0.1,
  "Phi_eff_i": 0.81,
  "boundary": { "publication_gate": "BLOCK", "contains_private_data": false, "public_safe": true }
}

